Note,Title,Content,Vote,Answer,View
73479295,How to do if statement and assignment in configparser config file?,"I want to use if statement and variable assignment in my config file.  Is it possible to do that? For example, I want to do this: [DEFAULT] ADMIN_PASSWD: ADMIN ROOT_PASSWD: ROOT [setup:password] begin:...",-2,0,28
73479294,AWS Lambda warm states & idempotency,"I have a Python 3.9 AWS Lambda whose Lambda Handler (lambda_function.lambda_handler) looks like this: from jobs.run import run_now from os import environ  def lambda_handler(event,context):   run_now()...",1,0,16
73479270,"TypeError: expected str, bytes or os.PathLike object, not tuple, Occurs on TextClip() call from MoviePy","I am attempting to concatenate edited video clips into a final movie video. The goal is to make small edits with the Streamer's name on each clip and overlay that text over each clip, then concatenate ...",1,1,17
73479259,Import .svg image and add title and label the x-y axes,I have an image in the .svg format. How do I import it to python and add title and label the axes? I tried the following: img = plt.imread('./tune.svg')  But it throws an error. Is there a way to do ...,0,1,28
73479252,Show every few X values on x axis (Matplotlib) instead of every value,I am trying to show the x values every couple of months instead of showing all of them. Currently it is showing every value. Which clutters the x axis. Is there an easy way to fix? The x value is ...,0,0,15
73479249,Can we know which project uses Cookiecutter vs Poetry vs other?,"It's probably a suboptimal thing to do, but whenever I am deciding which Python tool to use, I look at number of downloads and at adoption in mainstream projects. So, usually I look at numpy, scipy, ...",-1,0,14
73479234,"Crop an image (face) to 112, 112, even if face is bigger or smaller, and avoid distortion","I want to use face recognition model - AdaFace, but change its face detection algorithm, how do I crop an bounding box precisely to 112 to 112? Face can be smaller or bigger, or even be not square....",-2,0,13
73479229,Why is the pandas merge between these two dataframes looking like this?,I have a dataframe df_day down below as you can see             Day 2022-05-02  2 2022-05-03  3 2022-05-04  4 2022-05-05  5 2022-05-06  6 2022-05-07  7 2022-05-08  8 2022-05-09  9 2022-05-10  10 2022-...,0,1,21
73479221,how to capture background app events and logs using python [closed],"I don't know where to start to make a .py file to capture events and logs of applications that are running in the background of the application itself, I'm using robot as a framework for this ...",-2,0,22
73481153,AttributeError: 'DataFrame' object has no attribute 'explode',"My code is throwing this error when I try to run it, and I don't understand why. I'm confused as to why it's throwing an AttributeError when the line clearly calls .explode(...) as a function. Any ...",0,0,16
73481132,How to get data from views to consumers py. Django,"I wanted to get the data from my views.py def index(request):     if request.method == 'POST':         post_data = json.loads(request.body.decode(""utf-8""))         value = post_data.get('...",0,0,16
73481122,"Using google colab forms input as dropdown, can I put the read file and add on the total list?","I using google colab to share my code with people who don't know Python at all. To make it easy, I adapt forms into the cell which makes be able to select the options and parameters. parameters = &...",0,0,8
73481121,Optimizer Adagrad from Scratch in Python-Error,"I try to implement Adagrad algorithm with the next code: def back_propagate_Adagrad(error, learning_rate,eps):    self.cache=np.zeros(len(self.dW)+1)     for i in reversed(range(len(self.dW))):       ...",0,0,6
73481104,how to correct this code to verify for all the a's in the code to check for the sample code? [closed],"The following program calculates the number of input strings with letter ‘a’, and end the program when the input string is “####”. Here is an expected sample run: enter a string (enter #### to stop): ...",-1,1,26
73481094,How do I create a new module in django and register the classes in that module,"I want to create a new module and set of middleware classes in my app.  I created a subfolder ""middleware"" and put my python classes there in separate files.  But when I try to access them ...",0,1,20
73481092,How to pull values from JSON into pandas dataframe using a string as the index value,"I am looking to build a dataframe utilizing certain data from a JSON with multiple nested dictionaries. An example of the format of the JSON is as follows: ""leagueYear"": ""2021"",    ...",0,1,15
73481090,Drag and drop from QListWidget to QGraphicsItem,"I'm looking for how i can do the same thing like this : https://www.walletfox.com/course/dragdroplistscene.php with Python with PyQt5 library, but i don't know how i can do it. How i can do a subclass ...",0,0,9
73481089,Fast API request hangs when passing parameters to another endpoint,"When I reference another endpoint inside an async function in my Fast API script, that endpoint will hang and fail to load. Despite http://127.0.0.1:8000/data?nums=1&nums=2&nums=3 returning ...",0,0,13
73481059,Memory leak in AWS Lambda when calling local folder,I have a python script that I'm currently using just to figure out how to use a docker container image and deploy it to lambda using a few libraries. The code is as follows: from transformers import ...,0,0,11
73481035,Can't not use kwargs in tk.CheckButton [duplicate],"This is an qusition on tk.Checkbutton, i code a function to setting checkbutton from tkinter import Checkbutton, PhotoImage, Tk, BooleanVar def setCheckButton(root):     on_image = PhotoImage(width=...",0,0,10
73481033,How to make post request to list of webhooks at the same time python,i'm trying to make something that will take a url of a discord webhook and make a post request to it while also continuing in the loop for example:     await kdot.create_webhook(name='K.Dot#0001')     ...,-1,0,13
73481028,error with aiter in telethon bot in python,"i'm trying to loop inside my async function for my bot, and for the autodestruction function i have to iterate all the users and check if the user is an admin, done with this code: all_participants = ...",0,0,8
73481011,I want to upload my logs from ec2 to s3 through boto3 [closed],"My log name contains the date, and I want to collect and upload log data with those dates. But I dont know about python its my first time in my life help me and Thank you for your advise example ...",-3,0,20
73480989,Remove columns which match some pattern in python,"I have a large csv files which have several columns as follows: M_15_19_yr_ M_19_25_yr_ M_25_35_yr_ 20 34 12 09 21 19 I want to remove such columns which start from M_{age1}_{age2}_yr. I tried ...",3,2,25
73480966,"how can i import a function from another python file when the function is assigned to a variable name (ie from XYZ import f""{funcname}"" [duplicate]","So, i have some code that randomizes function names in another python file, it can find the function name just fine but how would i go about importing the function, ill better lay-out the question ...",0,0,9
73480938,"Calculate sum of multiples rows with a value in another column, and store the new value in a new column",I have a time series data where I would like to calculate sum of 4 quarters and divide the result with a value in another column. Here is my data example. In reality I will have 10K+ rows. df = pd....,1,1,17
73480911,AtributeError: __enter__ in python,"Performing a CRUD in python, I created the connection class where is two class methods: getConnection and getCursor, when I created the PersonDAO class and its class method called seleccionar and ...",-2,0,42
73480900,Organizing a list of dictionaries in Python,"I have a huge list of dictionaries with data labeled as follows {'id': 2,  'text': '""The hotel has many restaurants to enjoy a meal. My husband and I went to the Japanese restaurant and we only ...",0,2,40
73480884,"Need a solution so when I press Enter, turtle draws a different shape","The code I am trying to write needs to make 5 different shapes, which only one is included.   I am not worried about coding the other 4. What I need to know is how do I set it up so every time I press ...",0,1,26
73480869,ValueError: time data does not match format '%Y-%m-%d %H:%M:%S',"I use twint for scraping data from twitter. Code as follows import twint import nest_asyncio nest_asyncio.apply()  # Configure c = twint.Config() c.Limit = 500 c.Since = '2022-01-01' c.Until = '2022–...",0,0,18
73480849,Best practices for scheduling multiple jobs at different frequencies in a Python project?,"I have started scheduling a couple scripts in Python using launchd. All my imports are from the root directory, though, so unless I want to mess with sys.path (which feels like poor practice) I need ...",0,0,22
73480847,Datetime.strptime format for 2022-08-24T04:57:17.065000+00:00,"We have the following string in a variable: date_variable = ""2022-08-24T04:57:17.065000+00:00""  We would like to convert this to datetime. The following does not work: timestamp_formatted = ...",1,1,19
73480835,Sum percentages by condition,everyone. I don't know how to solve this. I would like to sum the percentages according to the result. Let me explain; all the % values for example with result i -1 should be summed (leaving the sign ...,0,1,39
73480827,Difference in Methods for Merging Transformed PDF Pages in PyPDF2,"I'm attempting to create a function to add a bottom ""margin"" to pages in existing PDFs.  Those bottom margins then need to be populated with specific text determined by the file and page.  I ...",0,0,4
73480826,Generating a list of sequences without repeating rows from a panda dataframe using Python,I am trying to create a a list of sequences based on the following three columns panda table. The data table would look like: |FROM|OPERATION|TO| |   2|       10| 1| |   2|       11| 4| |   1|       ...,-1,0,37
73480774,Can I create a Middleware class in one app that handles requests in other apps on the site,"In reading the, Middlware Documentation I can see I can write a middleware class that will see and has access to every request in my app, which is good. What if I want my Middleware to see and handle ...",0,0,27
73480771,Tox installs the wrong dependencies,"py310-django32-oauthlib1 create: /mydirectory py310-django32-oauthlib1 create: /mydirectory/.tox/py310-django32-oauthlib1 py310-django32-oauthlib1 installdeps: oauthlib==1.1.2, django~=3.2.10, ....etc ...",0,0,12
73480741,"Python dictionary where values are lists, how to remove Xth item from every list value","I have dictionary in the form of: dict_one =  { key2: [val1, val2, val3], key2: [val1, val2, val3] }  I want to remove 'val3' from every element in the dictionary. I believe this should be possible ...",0,3,34
73480737,is it possible that an 8 puzzle is unsolvable [closed],I am trying to create a Python program that solves the famous 8-puzzle. How do I check if the 8-puzzle is solvable? I tried the inversion method for this puzzle.  which resulted in the following 5 -&...,-2,0,33
73480734,How to send a list of emails using python and how to add image to my email,"I have a list of email but I dont know how to send it. I used this code but its not working. Also, I would like to know how to add an image. reading the spreadsheet email_list = pd.read_excel('path') ...",0,0,11
73480729,How do you get a cross section of data from a Pandas dataframe with a key for a MultiIndex?,"I have a dataframe like this A, B, C d, 1, 2 d, 3, 4 e, 5, 6 e, 7, 8  I am trying to get B, C 1, 2 3, 4  and B, C 5, 6 7, 8  By iterating through d, e, etc. I can get the keys just fine looping though ...",0,2,23
73480719,Leetcode difference between submission and console answer checking,"I have some code for Leetcode question 2266. (Python) https://leetcode.com/problems/count-number-of-texts/ class Solution:     def countTexts(self, pressedKeys: str) -> int:         # steps:        ...",0,0,14
73480711,List Index Out of Range on Function except the index shouldn't be out of range,I am working on a small function to assign random stats for a tabletop game I'm playing.  I'm fairly certain my code is clunky and I have variables I could probably merge somewhere.  I'm pretty new to ...,-1,0,25
73480688,Manipulating Switch Gyro controls with a mouse via USB Gadget,"Maybe I'm looking at this from the wrong angle, but I found code from a Japanese blog that translates the pro controller's gyro controls on switch to a mouse. One problem with this is that the ...",1,0,32
73480673,Cropping a TIFF to a ShapeFile,Hope you are well I was wondering how to take a tiff file and remove the area that is not of interest in this case I am taking tiff files with crs epsg:4326 and trying to cut it in to the shape of ...,0,0,9
73480666,Selenium Multi Browser won't run unless I open the browser window,I am running a code where multiple selenium browsers open via pyqt6 QThread class and run simultaneously. The problem is these browsers completely cover each other ( for example when the code opens 5 ...,0,0,12
73480640,Convert 16 bit hex value to FP16 in Python?,I'm trying to write a basic FP16 based calculator in python to help me debug some hardware. Can't seem to find how to convert 16b hex values unto floating point values I can use in my code to do the ...,0,1,21
73480637,"Generate n numbers in ascending order with their sum equal to m and difference between adjacent numbers increases by a constant number, in Python [closed]","I want to generate n numbers from 0 to m in such a way that all numbers are in ascending order and the difference between two adjacent numbers also increases by a constant number. For example, if I ...",0,0,34
73480622,plot each chart on a different scale with Seaborn Distplot,"I have some data that has widely different scales. I want to create a displot showing all the features on graphic. I though facet_kws={'sharex': False} was the relevant parameter, but it doesn't ...",0,0,12
73480615,Sublime Text 3 - Anaconda - Code Autoformatting failed for Python,"I know there have been a lot of questions regarding this, but they all tend to point towards changing the last line of the Anaconda user settings from the default ""python_interpreter"": ""...",0,0,5
73480607,Splitting strings based on another list with multiple words,"I have a dictionary of self-input locations and a list of possible locations from geonamescache. For example, a self-input user location could be ""san bernadino ca"" and the list of all ...",0,1,26
73480604,is there difference between print and return inside a function [duplicate],"I'm doing some Kaggle exercises and the question is asking me to ""In the cell below, define a function called sign which takes a numerical argument and returns -1 if it's negative, 1 if it's ...",0,1,22
73480603,Erroe while run conf file for odoo14 by pycharm,"when i run conf file to  make configuration for odoo 14 on pycharm i git this error, Traceback (most recent call last): File ""/home/salma/Documents/odoo14_1/odoo/odoo-bin"", line 5, in  ...",-1,0,12
73480599,add specific rows and column into another excel file using openpyxl in python,"I'm trying to merge multiple file into one excel file using openpyxl in python I know there is a way using panda, but my files have a problem there have been always 2 empty rows in the beginning of ...",0,0,12
73480589,python plotly: how to display additional label on hover,"I have two area subplots and when I hover over the plot, it displays the value of Val_2 and Val_Yellow. The dataframe contains a column called ""Diff"" that is the difference between Val_2 and ...",0,1,14
73480575,POST request list python-requests,"I am trying to POST Boxes = [{'X': 2423, 'Y': 532, 'W': 7456, 'H': 2345}] to the DRF server, I receive status code 200, However, on the server, I receive weird format: ""Boxes"": ""[{\&...",0,2,24
73480570,Blind Auction code works only with same # of digit inputs [duplicate],My goal is to write code that allows people to place blind bids and then display the winner from the max value of the dictionary at the end. It works perfectly within inputs of the same digits (ex. 10 ...,-1,1,14
73480568,Websocket 403 Handshake Cloudflare Python,Usually when connecting to this websocket (wss://sio-bf.blox.land/socket.io/?EIO=3&transport=websocket) you need to pass a cookie to get connected to it. The cookie is a cloudflare __cf_bm cookie. ...,-1,0,14
73480564,Give matplotlib histogram a list of tuples for bins?,"I have tried to pass a list of bins to matplotlib's hist() as such: bins = [(0, 5), (5, 10), (10, 15), (15, 20)], however matplotlib gives an error. Is there a way to do what I'm trying to do?",0,1,21
73480560,Command not executed on if statement being true,So I'm writing a simple program in Python that checks active window ID and in this program I have an if statement inside a while True loop that checks if the active window ID matches the expected ...,0,0,18
73480556,how to sucessfully install seaborn without error,"when i am running import seaborn as sns it throws me an error ""ImportError: DLL load failed while importing _cobyla: %1 is not a valid Win32 application."" kindly help me with the problem",0,0,12
73480551,"Error ""failed building wheel for cvxpy"" encountered when attempting to install CVXPY","I've encountered the error below while attempting to install the convex optimization library CVXPY. I previously encountered this (distinct) error, and was able to rectify it by updating my pip ...",0,0,22
73480527,PyQt5 : programmatically double click for Qtablewidget Item?,"with pyqt5, i made features : if i double click specific item on Qtablewidget, a new qwidget shows some information. and i want to make this job automatically - the code implenments ""double click&...",-1,0,12
73480526,"Apply transformation A for a subset of numerical columns and apply transformation B for all columns using pipeline, column transformer","I have a few columns (or say even one column) that I need to do imputation ( I don't want to do imputation on all the columns). Once imputation is done, I would like to do standard scalar on more ...",0,0,9
73480502,Pandas Duplicate A Row When Date in Column Exists and Delete Date in Original Row,I have a csv with an identifier and three columns that could contain a date or could be null. If the column contains a date. I need to make a copy of that row and delete the date from the original row....,0,0,26
73480494,Combining 2 tables based on different filters in one view,I've 2 dataframe tables created based on different filters that are being extracted as separate excel files. I would like to know an efficient way to combine both tables in one view based on different ...,0,0,40
73480492,Ban with bot telegram,"i'm trying to check if a user is an admin and ban him with my bot telegram using the telethon api, but the only method i found is client(EditBannedRequest(     channel, user, ChatBannedRights(         ...",0,0,12
73480423,Make a filter using a column from df in another df in python,I'm using this dataframe: # importando o dataframe url = 'https://raw.githubusercontent.com/ipauchner/DNC/main/kc_house_data.csv' df = pd.read_csv(url)  After some analysis I managed to separate 25 ...,0,0,18
73480417,Modifing a list in python [closed],"How can I delete ""//"" from a list?",1,2,49
73480409,Question on the result of this BASIC coding I wrote [closed],"I am a complete beginner on coding, and I am currently learning on Udemy. So, pardon if this question might sound really less than smart. There is this challenge that we need to write a code for ...",-2,0,24
73480392,Removing elements of dataframe with different number of columns,I have a tsv file that looks like this: BCM92732.1  sialidase   Abditibacteriota    bacterium VTR99890.1  sialidase   :   Sialidase   Precursor   OS=Rhodopirellula   baltica (strain SH1)    GN=RB3353  ...,0,1,18
73480388,Can't go through administrator protection with python,I was making a script to have a better look on which folder take the most place by going through all the folders and adding their size but i have some administrator problems when it comes to a ...,0,0,17
73480362,Compare two list and create similarity matrix output,I have a need to compare multiple list against each other. I would then like to create a summarized matrix output to show how simliar each list is against another.  For example: Input: List_Unique ...,-2,0,12
73480350,Python/uwsgi: Background process sets a variable value but requests cannot recognize it - how to stabilize this? [duplicate],"So, in my Flask app I have a Background Scheduler that is kicked off on application startup: scheduler = BackgroundScheduler(timezone=app.container.config.get(""app.timezone""))  # schedule ...",0,0,12
73480343,Why do I need to use a for loop with re.finditer()? [closed],I know when i use re.finditer() in return i will get some kind of a memory address but when i use for loop and loop over that memory address i get the right match object my question is : how can for ...,-1,0,28
73480334,What is the difference between `rclpy` and `rclpy.node` client library?,I am trying to learn how to use the ROS python client library rclpy to create ROS nodes. The example of a simple publisher node has the code: import rclpy from rclpy.node import Node  class Publisher(...,0,0,9
73480319,A common store purchase management system in python or java [closed],I need a code for a common store management system in python or java please.,-3,0,20
73480286,Filtering dataframe records given a date range. Python,"My df fields are 'User ID' (string), 'Last Login' (%Y-%m-%d %H:%M:%S). I want to know the User IDs that haven't Logged in for the past 3 months. The 'Last Login' field contains 12 months of login ...",-1,2,23
73480285,Expected Indent Block | Python [duplicate],I can't figure out where I messed up and was hoping the internet could help Here's my code: while True:     #Main Loop     if (keyboard.is_pressed('escape')):         break     moveX(int(keyboard....,-2,0,25
73480261,python boto3 aws lambda - An error occurred (IncorrectInstanceState) when calling the StartInstances operation:,"I wrote a lambda using python boto3 to bring up all EC2 instances. It works fine. I went ahead and terminated 2 instances. When I run the code now, it tries to bring up the terminated instances also. ...",0,1,14
73480252,Can't find table when scraping with beautifulsoup,"I have r = requests.get(""https://baseballsavant.mlb.com/leaderboard/custom?year=2021&type=batter&filter=&sort=5&sortDir=desc&min=q&selections=r_total_stolen_base,...",0,1,17
73480231,Increment class instance counter in Python,"I'm not well versed in Python as I have a Java background. I have this simple class: ## Class declaration class SemVersion:     major: int     minor: int     patch: int      def __init__(self, major, ...",0,2,41
73480212,Filtering on several criteria but some can be not used at times,I would like to get a subset of a dataframe by filtering based on inputted parameters. But some of the parameters may not be used at all time (= 'None' when not used). I have no problem when the ...,0,0,22
73480173,"Python exception from one method to another, how does it work",Hi I'm a bit lost with the exception and error hierarchy and I'd like to know how to manage properly Basically let's say I want to have a task with retry @app.MyTask(bind=True) try:  doThis() except(...,0,1,21
73480171,How to extract some values from string in column in DataFrame in Pandas Python?,"I have DataFrame in Python Pandas like below (""col1"" is ""object"" data type): col1 ------------ {""CITY"":""MADRID"",""A_DT"":""2022-05-10T00:00"",&...",0,2,23
73480162,How to encode dates to dummies in dataframe using a python function,I have this initial df: Month   A           B           C Feb     2/6/2021    2/5/2021    2/6/2021 Mar     3/1/2021    3/1/2021    3/3/2021  And I want to encode dates like: Date        A   B   C 2/5/...,-2,0,25
73480155,Using python variable in HTML to display image,I am setting up a webserver with flask and seaborn/matplotlib. There I am creating and assigning a variable in Python img_buffer of type IOBytes to represent a graph. Then I am transforming this data ...,-1,1,22
73480129,Is there a way to access a HTML form's ID in Python after it has been submitted?,"I have a HTML form and the ID of that form contains information. I need that information in Python but I am struggling to access it. I have used id = request.form.get(""id"") but it doesn't ...",-3,0,21
73480128,Why is os.startfile causing my printer to crash when trying to print a pdf with Python? [closed],"I am using os.startfile(filename, ""print""). On one printer it worked perfectly fine and printed my document, so I know that the script works. However, when I run my script on another ...",0,0,12
73480122,Split Data Frame into New Dataframe for each consecutive Column,Looking to split columns of this data frame into multiple data frames. Each with the date column and the consecutive column. How do I get a function that can automate this. So we would have n data ...,2,1,18
73480103,Select rows based on column condition and date time,"From below picture, we see that serial C was failed on 3rd January, and A failed on 5th January within 6 days period. I am interested to take samples for 3 days before the failure of each serial ...",1,1,30
73480084,databricks can't find file from installed wheel file,"In Python I have a test.py script in the classes folder which simply gets a JSON file in the schemas folder which works fine:  I've packaged this up into a wheel file, ensuring that the setup file ...",0,0,20
